{
  "id": "ilko-2026-incheon-participating",
  "url": "https://illustrationkorea.co.kr/incheon/participating/participating/",
  "publisher": "일러스트코리아 사무국",
  "tier": "S1",
  "kind": "official-application",
  "eventMasterIds": [
    "illustration-korea"
  ],
  "recheckDays": 3,
  "checkedAt": "2026-08-11T02:36:22.037Z",
  "recheckDueAt": "2026-08-14T02:36:22.037Z",
  "availability": "accessible",
  "robots": "allowed",
  "httpStatus": 200,
  "contentType": "text/html",
  "contentHash": "b2988e637c6e68eab3c188ece9cd44f6e3694ab93802d97f95f03b2fd521dd40",
  "payloadHash": "f07496a566d00fc0325ac40704515a29eaba628bdb9880947b9587b7fdb6f23e",
  "previousContentHash": "b2988e637c6e68eab3c188ece9cd44f6e3694ab93802d97f95f03b2fd521dd40",
  "changeStatus": "unchanged",
  "title": "출품안내 - 일러스트레이션 - 인천",
  "bytes": 1480970,
  "normalizedTextBytes": 6039,
  "cachePath": ".content-cache/official/ilko-2026-incheon-participating.html"
}
