{
  "id": "venue-suwon-messe",
  "url": "https://suwonmesse.com/suwonmesse/contact/",
  "publisher": "수원메쎄",
  "tier": "S2",
  "kind": "official-venue",
  "eventMasterIds": [
    "illustration-korea"
  ],
  "recheckDays": 90,
  "checkedAt": "2026-08-11T02:36:24.080Z",
  "recheckDueAt": "2026-11-09T02:36:24.080Z",
  "availability": "accessible",
  "robots": "allowed",
  "httpStatus": 200,
  "contentType": "text/html",
  "contentHash": "2c36f14e31b04f7649583e7928c686162ca86a90c728720cb58ba1a248fca7c9",
  "payloadHash": "f205663e73e38ad44c63b8d3e5631454de4ece27f1703d6b1e75fb78a4ec7e5a",
  "previousContentHash": "2c36f14e31b04f7649583e7928c686162ca86a90c728720cb58ba1a248fca7c9",
  "changeStatus": "unchanged",
  "title": "오시는 길 - 수원메쎄",
  "bytes": 1504858,
  "normalizedTextBytes": 2631,
  "cachePath": ".content-cache/official/venue-suwon-messe.html"
}
