{
  "id": "ilko-2026-incheon-home",
  "url": "https://illustrationkorea.co.kr/incheon/",
  "publisher": "일러스트코리아 사무국",
  "tier": "S1",
  "kind": "official-edition",
  "eventMasterIds": [
    "illustration-korea"
  ],
  "recheckDays": 7,
  "checkedAt": "2026-08-11T02:36:21.942Z",
  "recheckDueAt": "2026-08-18T02:36:21.942Z",
  "availability": "accessible",
  "robots": "allowed",
  "httpStatus": 200,
  "contentType": "text/html",
  "contentHash": "8d1ba5146e05cf7e46ec49c3d871dffb50b840a093ac38e0edb95adcc53ba7d0",
  "payloadHash": "585a5517c7c5eb0f3a599b8f21e1b1f505fcf8e62cd9ad50461d91fe354658b3",
  "previousContentHash": "8d1ba5146e05cf7e46ec49c3d871dffb50b840a093ac38e0edb95adcc53ba7d0",
  "changeStatus": "unchanged",
  "title": "2026 인천 일러스트코리아 - 일러스트레이션 - 인천",
  "bytes": 1762568,
  "normalizedTextBytes": 8693,
  "cachePath": ".content-cache/official/ilko-2026-incheon-home.html"
}
